{
  "schema_version": "0.3.0",
  "project_id": "NINEL",
  "source_context": {
    "character_ids": [
      "NINEL-CH001",
      "NINEL-CH002"
    ],
    "scene_ids": [
      "NINEL-E01-SC001",
      "NINEL-E02-SC001"
    ],
    "shots": [
      {
        "scene_id": "NINEL-E01-SC001",
        "shot_id": "NINEL-E01-SC001-SH001"
      },
      {
        "scene_id": "NINEL-E01-SC001",
        "shot_id": "NINEL-E01-SC001-SH002"
      },
      {
        "scene_id": "NINEL-E02-SC001",
        "shot_id": "NINEL-E02-SC001-SH001"
      },
      {
        "scene_id": "NINEL-E02-SC001",
        "shot_id": "NINEL-E02-SC001-SH002"
      }
    ],
    "identity_statements": [
      {
        "character_id": "NINEL-CH001",
        "claim": {
          "value": "A stranded nonhuman android explorer.",
          "provenance": {
            "status": "supplied",
            "basis": "The supplied character-arcs context states this identity fact.",
            "source_reference": "character-arcs.json#characters/NINEL-CH001"
          }
        }
      },
      {
        "character_id": "NINEL-CH001",
        "claim": {
          "value": "One triangular sensor inset remains on the right temple.",
          "provenance": {
            "status": "supplied",
            "basis": "The supplied character-arcs context states this identity fact.",
            "source_reference": "character-arcs.json#characters/NINEL-CH001"
          }
        }
      },
      {
        "character_id": "NINEL-CH001",
        "claim": {
          "value": "The supplied chest seam may change from unlit to cyan-lit.",
          "provenance": {
            "status": "supplied",
            "basis": "The supplied character-arcs context states this identity fact.",
            "source_reference": "character-arcs.json#characters/NINEL-CH001"
          }
        }
      },
      {
        "character_id": "NINEL-CH001",
        "claim": {
          "value": "Preserve the supplied compact overall build; exact ratios are unknown.",
          "provenance": {
            "status": "supplied",
            "basis": "The supplied character-arcs context states this identity fact.",
            "source_reference": "character-arcs.json#characters/NINEL-CH001"
          }
        }
      },
      {
        "character_id": "NINEL-CH001",
        "claim": {
          "value": "Nonhuman ceramic shell with three articulated digits on each hand.",
          "provenance": {
            "status": "supplied",
            "basis": "The supplied character-arcs context states this identity fact.",
            "source_reference": "character-arcs.json#characters/NINEL-CH001"
          }
        }
      },
      {
        "character_id": "NINEL-CH001",
        "claim": {
          "value": "Preserve ceramic shell separation and the supplied cyan chest signal; other colors remain unknown.",
          "provenance": {
            "status": "supplied",
            "basis": "The supplied character-arcs context states this identity fact.",
            "source_reference": "character-arcs.json#characters/NINEL-CH001"
          }
        }
      },
      {
        "character_id": "NINEL-CH001",
        "claim": {
          "value": "No hair or makeup is established for this nonhuman shell.",
          "provenance": {
            "status": "supplied",
            "basis": "The supplied character-arcs context states this identity fact.",
            "source_reference": "character-arcs.json#characters/NINEL-CH001"
          }
        }
      },
      {
        "character_id": "NINEL-CH001",
        "claim": {
          "value": "Dormant repose and a controlled right-hand raise are required.",
          "provenance": {
            "status": "supplied",
            "basis": "The supplied character-arcs context states this identity fact.",
            "source_reference": "character-arcs.json#characters/NINEL-CH001"
          }
        }
      },
      {
        "character_id": "NINEL-CH001",
        "claim": {
          "value": "Do not move, mirror, duplicate, or reshape the right-temple sensor.",
          "provenance": {
            "status": "supplied",
            "basis": "The supplied character-arcs context states this identity fact.",
            "source_reference": "character-arcs.json#characters/NINEL-CH001"
          }
        }
      },
      {
        "character_id": "NINEL-CH001",
        "claim": {
          "value": "Not applicable to the supplied nonhuman shell.",
          "provenance": {
            "status": "supplied",
            "basis": "The supplied character-arcs context states this identity fact.",
            "source_reference": "character-arcs.json#characters/NINEL-CH001"
          }
        }
      },
      {
        "character_id": "NINEL-CH001",
        "claim": {
          "value": "The chest seam remains unlit while dormant.",
          "provenance": {
            "status": "supplied",
            "basis": "The supplied character-arcs context states this identity fact.",
            "source_reference": "character-arcs.json#characters/NINEL-CH001"
          }
        }
      },
      {
        "character_id": "NINEL-CH001",
        "claim": {
          "value": "The chest seam changes to cyan-lit after awakening.",
          "provenance": {
            "status": "supplied",
            "basis": "The supplied character-arcs context states this identity fact.",
            "source_reference": "character-arcs.json#characters/NINEL-CH001"
          }
        }
      }
    ]
  },
  "characters": [
    {
      "character_id": "NINEL-CH001",
      "name": "Ninel",
      "supplied_identity": {
        "value": "A stranded nonhuman android explorer.",
        "provenance": {
          "status": "supplied",
          "basis": "The supplied character-arcs context states this identity fact.",
          "source_reference": "character-arcs.json#characters/NINEL-CH001"
        }
      },
      "visual_treatment": {
        "value": "Keep the supplied shell and sensor readable through restrained shape grouping.",
        "provenance": {
          "status": "proposed",
          "basis": "This bounded treatment makes the supplied identity readable without adding identity facts.",
          "source_reference": "character-arcs.json#characters/NINEL-CH001"
        }
      },
      "immutable_anchors": [
        {
          "anchor_id": "NINEL-CH001-AN001",
          "aspect": "right-temple sensor",
          "claim": {
            "value": "One triangular sensor inset remains on the right temple.",
            "provenance": {
              "status": "supplied",
              "basis": "The supplied character-arcs context states this identity fact.",
              "source_reference": "character-arcs.json#characters/NINEL-CH001"
            }
          }
        }
      ],
      "permitted_variations": [
        {
          "value": "The supplied chest seam may change from unlit to cyan-lit.",
          "provenance": {
            "status": "supplied",
            "basis": "The supplied character-arcs context states this identity fact.",
            "source_reference": "character-arcs.json#characters/NINEL-CH001"
          }
        }
      ],
      "proportions": [
        {
          "value": "Preserve the supplied compact overall build; exact ratios are unknown.",
          "provenance": {
            "status": "supplied",
            "basis": "The supplied character-arcs context states this identity fact.",
            "source_reference": "character-arcs.json#characters/NINEL-CH001"
          }
        }
      ],
      "face_body_descriptors": {
        "applicability": "specified",
        "details": [
          {
            "value": "Nonhuman ceramic shell with three articulated digits on each hand.",
            "provenance": {
              "status": "supplied",
              "basis": "The supplied character-arcs context states this identity fact.",
              "source_reference": "character-arcs.json#characters/NINEL-CH001"
            }
          }
        ]
      },
      "silhouette": [
        {
          "value": "A compact shell outline remains recognizable at full-body scale.",
          "provenance": {
            "status": "proposed",
            "basis": "This bounded treatment makes the supplied identity readable without adding identity facts.",
            "source_reference": "character-arcs.json#characters/NINEL-CH001"
          }
        }
      ],
      "palette": [
        {
          "value": "Preserve ceramic shell separation and the supplied cyan chest signal; other colors remain unknown.",
          "provenance": {
            "status": "supplied",
            "basis": "The supplied character-arcs context states this identity fact.",
            "source_reference": "character-arcs.json#characters/NINEL-CH001"
          }
        }
      ],
      "hair_makeup": {
        "applicability": "not-applicable",
        "details": [
          {
            "value": "No hair or makeup is established for this nonhuman shell.",
            "provenance": {
              "status": "supplied",
              "basis": "The supplied character-arcs context states this identity fact.",
              "source_reference": "character-arcs.json#characters/NINEL-CH001"
            }
          }
        ]
      },
      "expression_range": [
        {
          "value": "Use only expression behavior supported by the nonhuman sensor and pose design.",
          "provenance": {
            "status": "proposed",
            "basis": "This bounded treatment makes the supplied identity readable without adding identity facts.",
            "source_reference": "character-arcs.json#characters/NINEL-CH001"
          }
        }
      ],
      "pose_range": [
        {
          "value": "Dormant repose and a controlled right-hand raise are required.",
          "provenance": {
            "status": "supplied",